{"$schema":"https://json-schema.org/draft/2020-12/schema","$id":"https://mindclade.dev/schemas/training-run-manifest/v1","title":"TrainingRunManifest","type":"object","additionalProperties":false,"required":["schema_version","kind","metadata","spec","lineage","integrity"],"properties":{"schema_version":{"const":"mindclade.training-run-manifest/v1"},"kind":{"const":"TrainingRunManifest"},"metadata":{"$ref":"#/$defs/metadata"},"spec":{"type":"object","additionalProperties":false,"required":["run","recipe","executable_plan","plan_digest","plan_digest_verified","attempt_id","lease_epoch","status","checkpoints"],"properties":{"run":{"type":"string","pattern":"^tenants/[A-Za-z0-9._~-]+/projects/[A-Za-z0-9._~-]+/trainingRuns/[A-Za-z0-9._~-]+$"},"recipe":{"$ref":"#/$defs/artifact_ref"},"executable_plan":{"$ref":"#/$defs/artifact_ref"},"plan_digest":{"$ref":"#/$defs/digest"},"plan_digest_verified":{"const":true},"attempt_id":{"type":"string","minLength":1,"maxLength":128},"lease_epoch":{"type":"integer","minimum":1},"status":{"enum":["ADMITTED","RUNNING","SUCCEEDED","FAILED","CANCELLED"]},"checkpoints":{"type":"array","maxItems":1024,"items":{"$ref":"#/$defs/artifact_ref"}},"terminal_evidence":{"$ref":"#/$defs/artifact_ref"}}},"lineage":{"type":"array","minItems":2,"maxItems":64,"items":{"$ref":"#/$defs/artifact_ref"}},"integrity":{"$ref":"#/$defs/integrity"}},"$defs":{"digest":{"type":"string","pattern":"^sha256:[a-f0-9]{64}$"},"metadata":{"type":"object","additionalProperties":false,"required":["uid","created_at","producer","classification"],"properties":{"uid":{"type":"string","minLength":1,"maxLength":128},"created_at":{"type":"string","format":"date-time"},"producer":{"type":"string","minLength":1,"maxLength":128},"classification":{"enum":["PUBLIC","INTERNAL","RESTRICTED"]}}},"artifact_ref":{"type":"object","additionalProperties":false,"required":["uri","digest","media_type","schema_version"],"properties":{"uri":{"type":"string","pattern":"^artifacts/[A-Za-z0-9._~/-]+$"},"digest":{"$ref":"#/$defs/digest"},"media_type":{"type":"string","minLength":1,"maxLength":128},"schema_version":{"type":"string","minLength":1,"maxLength":128}}},"integrity":{"type":"object","additionalProperties":false,"required":["payload_digest"],"properties":{"payload_digest":{"$ref":"#/$defs/digest"},"evidence":{"type":"array","maxItems":32,"items":{"$ref":"#/$defs/artifact_ref"}}}}}}
