{"schema_version":"mindclade.training-run-manifest/v1","kind":"TrainingRunManifest","metadata":{"uid":"run-001","created_at":"2026-08-31T12:00:00Z","producer":"training-service","classification":"RESTRICTED"},"spec":{"run":"tenants/t1/projects/p1/trainingRuns/run-001","recipe":{"uri":"artifacts/training-recipes/001","digest":"sha256:aaaaaaaaaaaaaaaaaaaaaaaaaaaaaaaaaaaaaaaaaaaaaaaaaaaaaaaaaaaaaaaa","media_type":"application/schema+json","schema_version":"mindclade.training-recipe/v1"},"executable_plan":{"uri":"artifacts/executable-plans/001","digest":"sha256:bbbbbbbbbbbbbbbbbbbbbbbbbbbbbbbbbbbbbbbbbbbbbbbbbbbbbbbbbbbbbbbb","media_type":"application/schema+json","schema_version":"mindclade.executable-plan/v1"},"plan_digest":"sha256:bbbbbbbbbbbbbbbbbbbbbbbbbbbbbbbbbbbbbbbbbbbbbbbbbbbbbbbbbbbbbbbb","plan_digest_verified":true,"attempt_id":"attempt-001","lease_epoch":1,"status":"RUNNING","checkpoints":[]},"lineage":[{"uri":"artifacts/training-recipes/001","digest":"sha256:aaaaaaaaaaaaaaaaaaaaaaaaaaaaaaaaaaaaaaaaaaaaaaaaaaaaaaaaaaaaaaaa","media_type":"application/schema+json","schema_version":"mindclade.training-recipe/v1"},{"uri":"artifacts/executable-plans/001","digest":"sha256:bbbbbbbbbbbbbbbbbbbbbbbbbbbbbbbbbbbbbbbbbbbbbbbbbbbbbbbbbbbbbbbb","media_type":"application/schema+json","schema_version":"mindclade.executable-plan/v1"}],"integrity":{"payload_digest":"sha256:cccccccccccccccccccccccccccccccccccccccccccccccccccccccccccccccc","evidence":[]}}
